{
  "schemaVersion": "makers-anvil.learning-coverage.v1",
  "claimState": "proven",
  "guidePath": "docs/LINE_BY_LINE_CODE_GUIDE.md",
  "sourceCount": 92,
  "totalLineCount": 16417,
  "explainedLineCount": 16417,
  "files": [
    {
      "path": ".github/workflows/ci.yml",
      "sha256": "4ccba6a2afd3a7dcc73a7c638758c157b74f5126c058f7307f8e144851fcb6a9",
      "lineCount": 35,
      "explainedLineCount": 35,
      "guideAnchor": "source-001"
    },
    {
      "path": ".gitignore",
      "sha256": "ca7f22c353b85ecc49d8d520972a1d38a09e2c60f4bed2d2eedc38afe8023700",
      "lineCount": 31,
      "explainedLineCount": 31,
      "guideAnchor": "source-002"
    },
    {
      "path": "LICENSE",
      "sha256": "da709383c830e745a2cf6e3180590dd2223b3e63bb8982da7b2bbde56c5c5204",
      "lineCount": 21,
      "explainedLineCount": 21,
      "guideAnchor": "source-003"
    },
    {
      "path": "backend/src/makers_anvil_backend/__init__.py",
      "sha256": "71f5d174bc7e74cc60a7d28bb5b262e84cd5a18bcb68f98e45c9f58b0a4c2bff",
      "lineCount": 14,
      "explainedLineCount": 14,
      "guideAnchor": "source-004"
    },
    {
      "path": "backend/src/makers_anvil_backend/__main__.py",
      "sha256": "1143087638f02d96d8951934973c5a51f6f4d83491cce2ff5465e182d40a054d",
      "lineCount": 14,
      "explainedLineCount": 14,
      "guideAnchor": "source-005"
    },
    {
      "path": "backend/src/makers_anvil_backend/api/__init__.py",
      "sha256": "e2c9fa9c53cf1e429b67cbe0eb94b3c20b718e19dd76d1c1c28c8c0037ee3ed8",
      "lineCount": 10,
      "explainedLineCount": 10,
      "guideAnchor": "source-006"
    },
    {
      "path": "backend/src/makers_anvil_backend/api/app.py",
      "sha256": "2a1390a20a8ce321dd9863de57537671e0f186c1da3433e7633af817571a802b",
      "lineCount": 150,
      "explainedLineCount": 150,
      "guideAnchor": "source-007"
    },
    {
      "path": "backend/src/makers_anvil_backend/domain/__init__.py",
      "sha256": "816113dcdf76b48db62e52726170b09b3c08a9fcb0a26cab4ae24a959817ed51",
      "lineCount": 10,
      "explainedLineCount": 10,
      "guideAnchor": "source-008"
    },
    {
      "path": "backend/src/makers_anvil_backend/domain/claim_state.py",
      "sha256": "6d10240e108bde4b633ccdf3fcf87419c3926c842344456eb73935d1ce1dfc53",
      "lineCount": 57,
      "explainedLineCount": 57,
      "guideAnchor": "source-009"
    },
    {
      "path": "backend/src/makers_anvil_backend/server.py",
      "sha256": "aa726af0989824e186924a69194f1ee31e69926ebc122b118e27eab2098e264c",
      "lineCount": 181,
      "explainedLineCount": 181,
      "guideAnchor": "source-010"
    },
    {
      "path": "backend/src/makers_anvil_backend/services/__init__.py",
      "sha256": "4d10473f485e73839495f3bd67588ecbb5eef92527be4cccd80f2355e8fe18cd",
      "lineCount": 10,
      "explainedLineCount": 10,
      "guideAnchor": "source-011"
    },
    {
      "path": "backend/src/makers_anvil_backend/services/app_state.py",
      "sha256": "0000df3a62c9ca2aff8c6bfb7ffc7a816302a1f8dff3a7318d5edd898aa25055",
      "lineCount": 530,
      "explainedLineCount": 530,
      "guideAnchor": "source-012"
    },
    {
      "path": "backend/src/makers_anvil_backend/services/execution_gate.py",
      "sha256": "20c3b0706cf70e6b614791726ae1aa0e8c719d6242a616d1c728a015f385f632",
      "lineCount": 289,
      "explainedLineCount": 289,
      "guideAnchor": "source-013"
    },
    {
      "path": "backend/src/makers_anvil_backend/services/execution_request.py",
      "sha256": "ac01f0a6ac304bf9f38049fd95ad7cef693edea84e54c7af536fedcc65704a67",
      "lineCount": 267,
      "explainedLineCount": 267,
      "guideAnchor": "source-014"
    },
    {
      "path": "backend/src/makers_anvil_backend/services/intake_catalog.py",
      "sha256": "629a6242944c3c5c60c2a706b338c334a3738e6221895ac92d6346b1c719d150",
      "lineCount": 311,
      "explainedLineCount": 311,
      "guideAnchor": "source-015"
    },
    {
      "path": "backend/src/makers_anvil_backend/services/job_records.py",
      "sha256": "e777bfdd48dd1d74fcfbc24c40c33e3df3b6888e801acff05ad21e56a15ae98b",
      "lineCount": 345,
      "explainedLineCount": 345,
      "guideAnchor": "source-016"
    },
    {
      "path": "backend/src/makers_anvil_backend/services/job_workspace.py",
      "sha256": "76d4489a414f68572d0723fd716845a91bfd280551255779445c371280d27d9b",
      "lineCount": 450,
      "explainedLineCount": 450,
      "guideAnchor": "source-017"
    },
    {
      "path": "backend/src/makers_anvil_backend/services/output_proof.py",
      "sha256": "8aba30626e5438836e494eb8e98e4dfd5ab8f5a5f09160b38954b8cb8caf4f05",
      "lineCount": 307,
      "explainedLineCount": 307,
      "guideAnchor": "source-018"
    },
    {
      "path": "backend/src/makers_anvil_backend/services/route_preview.py",
      "sha256": "701899c09d440f8c58d2f0ab6285d40326b21c8741375c67c01416e94faabd5f",
      "lineCount": 243,
      "explainedLineCount": 243,
      "guideAnchor": "source-019"
    },
    {
      "path": "backend/src/makers_anvil_backend/services/runtime_paths.py",
      "sha256": "a016f07199825633d19dc7cb48098e452d30db1eda9d6088d6ff4cfb77768d7b",
      "lineCount": 230,
      "explainedLineCount": 230,
      "guideAnchor": "source-020"
    },
    {
      "path": "backend/src/makers_anvil_backend/services/tool_detection.py",
      "sha256": "5c029726f39fd7f4206710f8fcfefef2e856b5db5636d5f504fa8352c6144920",
      "lineCount": 379,
      "explainedLineCount": 379,
      "guideAnchor": "source-021"
    },
    {
      "path": "backend/src/makers_anvil_backend/services/tool_dry_run.py",
      "sha256": "9c9db69871b452a6c0326d85c3308766f65da8c54bca10c3b0e788830867b2ac",
      "lineCount": 304,
      "explainedLineCount": 304,
      "guideAnchor": "source-022"
    },
    {
      "path": "backend/src/makers_anvil_backend/services/workspace_config.py",
      "sha256": "b52c0af04f1edfd4e46a65914ae672e056400994b4ff6afd1719e2027501972d",
      "lineCount": 249,
      "explainedLineCount": 249,
      "guideAnchor": "source-023"
    },
    {
      "path": "backend/src/makers_anvil_backend/services/workspace_status.py",
      "sha256": "7a59e2eeeed4f20cca2b7751977b4518b97e2b396dd4efa6cae821eda03bad85",
      "lineCount": 126,
      "explainedLineCount": 126,
      "guideAnchor": "source-024"
    },
    {
      "path": "config/default_settings.json",
      "sha256": "d07f557b0b601280639fc8fc1ebfccc3be29433350532e0b14ab1db7382b6c0b",
      "lineCount": 52,
      "explainedLineCount": 52,
      "guideAnchor": "source-025"
    },
    {
      "path": "config/execution_gate_policy.json",
      "sha256": "6505b248b380b6ca0dbe7dea32b931352f8402ee0ecdf352826a18357e469c62",
      "lineCount": 95,
      "explainedLineCount": 95,
      "guideAnchor": "source-026"
    },
    {
      "path": "config/execution_request_policy.json",
      "sha256": "e28a23fc8e9156137bf9f0fd38d6eae866c6ca192d0565c1d4f4812251c67aa7",
      "lineCount": 35,
      "explainedLineCount": 35,
      "guideAnchor": "source-027"
    },
    {
      "path": "config/intake_policy.json",
      "sha256": "e1696e6053a41cba286a3b6ffd5c8001da780267b67d7d882cd4d32f27b0f11a",
      "lineCount": 45,
      "explainedLineCount": 45,
      "guideAnchor": "source-028"
    },
    {
      "path": "config/job_workspace_policy.json",
      "sha256": "aa2ac292d71f32a18b4d148703d379b932fc7169d811bee0ab3cf3e855402d6e",
      "lineCount": 37,
      "explainedLineCount": 37,
      "guideAnchor": "source-029"
    },
    {
      "path": "config/output_policy.json",
      "sha256": "2aee81c4642070ceaf24caa37321635d85e977c7dab1510e1385f446927f00fb",
      "lineCount": 81,
      "explainedLineCount": 81,
      "guideAnchor": "source-030"
    },
    {
      "path": "config/route_catalog.json",
      "sha256": "10db5e19a5526633e1601b6dbf86f1d6fc175caca74b488069e91eccc4810a9e",
      "lineCount": 99,
      "explainedLineCount": 99,
      "guideAnchor": "source-031"
    },
    {
      "path": "config/tool_catalog.json",
      "sha256": "63c1dbdbaeaa3408b8755723267788c6061129d184f79b8069ebcc980c5119f4",
      "lineCount": 98,
      "explainedLineCount": 98,
      "guideAnchor": "source-032"
    },
    {
      "path": "config/tool_dry_run_policy.json",
      "sha256": "2093ba69eb0bd6c088bb42178e2afff080fe641ff389f83ae532ba7055319487",
      "lineCount": 59,
      "explainedLineCount": 59,
      "guideAnchor": "source-033"
    },
    {
      "path": "frontend/public/assets/app.js",
      "sha256": "1dd970227108a947c544473eac7ad0484848e71a6fcc2efbaf0dce884673dfd8",
      "lineCount": 1055,
      "explainedLineCount": 1055,
      "guideAnchor": "source-034"
    },
    {
      "path": "frontend/public/assets/mark.svg",
      "sha256": "c357f624a6826400b2ff035a27ef30697a38f9b5b7aa5b2bad18779d47945732",
      "lineCount": 17,
      "explainedLineCount": 17,
      "guideAnchor": "source-035"
    },
    {
      "path": "frontend/public/assets/styles.css",
      "sha256": "c8aff7d8d8ccfc42e7a166522b60653ac9429d1c330ad2fff05aa837554caccf",
      "lineCount": 2130,
      "explainedLineCount": 2130,
      "guideAnchor": "source-036"
    },
    {
      "path": "frontend/public/index.html",
      "sha256": "ac65dff7be574725adef2504cf632778a555ef60111ecb48d3466ac17cbf2836",
      "lineCount": 378,
      "explainedLineCount": 378,
      "guideAnchor": "source-037"
    },
    {
      "path": "package.json",
      "sha256": "e3b1dcbeb38fbb3d011e9bff721ac3e6017b1be85173e5eeb545be968d0e3235",
      "lineCount": 21,
      "explainedLineCount": 21,
      "guideAnchor": "source-038"
    },
    {
      "path": "pyproject.toml",
      "sha256": "78836c5f279f9a3d59ff5746ee5dcf191e2adde14c4df45154adfe68a2a1c999",
      "lineCount": 11,
      "explainedLineCount": 11,
      "guideAnchor": "source-039"
    },
    {
      "path": "schemas/app-state.schema.json",
      "sha256": "da88b0ef3da9a3d292a59f8c0d4a8b1bbab759e25e28d9533a04b3dde9ad7e28",
      "lineCount": 65,
      "explainedLineCount": 65,